{
  "contract": "project_conventions_v1",
  "id": "eval-existing-salt-team",
  "version": "1.0.0",
  "project": "eval-existing-salt-policy",
  "approved_wrappers": [
    {
      "name": "AppShellFrame",
      "wraps": "BorderLayout",
      "reason": "Teams can apply the shared shell wrapper after the canonical Salt layout choice is confirmed.",
      "import": {
        "from": "@/shell/AppShellFrame",
        "name": "AppShellFrame"
      }
    }
  ],
  "notes": [
    "Keep canonical Salt pattern selection separate from repo-local wrappers."
  ]
}
