{
  "contract": "project_conventions_v1",
  "version": "1.0.0",
  "project": "sample-salt-app",
  "preferred_components": [
    {
      "salt_name": "Button",
      "prefer": "AppButton",
      "reason": "Product surfaces use a shared wrapper for analytics, sentiment defaults, and loading behavior.",
      "docs": ["./docs/app-button.md"]
    }
  ],
  "approved_wrappers": [
    {
      "name": "AppButton",
      "wraps": "Button",
      "reason": "Adds analytics and approved product defaults without changing the canonical Salt primitive underneath.",
      "import": {
        "from": "@/components/AppButton",
        "name": "AppButton"
      },
      "use_when": ["primary product actions", "toolbar actions"],
      "avoid_when": ["sandbox examples"],
      "migration_shim": false,
      "docs": ["./docs/app-button.md"]
    }
  ],
  "token_aliases": [
    {
      "salt_name": "--salt-container-primary-borderColor",
      "prefer": "--markets-border-default",
      "reason": "Markets surfaces consume the local border alias so product theming stays centralized.",
      "docs": ["./docs/token-aliases.md"]
    }
  ],
  "theme_defaults": {
    "provider": "BrandShellProvider",
    "provider_import": {
      "from": "@/theme/BrandShellProvider",
      "name": "BrandShellProvider"
    },
    "imports": ["@/theme/brand-shell.css"],
    "props": [
      {
        "name": "density",
        "value": "high"
      }
    ],
    "reason": "This repo applies one approved theme shell around canonical Salt theme defaults.",
    "docs": ["./docs/platform-conventions.md"]
  },
  "token_family_policies": [
    {
      "family": "container",
      "mode": "prefer-local-aliases",
      "reason": "Container roles map through local aliases so app-level theming can vary without changing component code.",
      "docs": ["./docs/token-aliases.md"]
    }
  ],
  "pattern_preferences": [
    {
      "intent": "workspace shell navigation",
      "prefer": "WorkspaceShell",
      "canonical_salt_start": "VerticalNavigation",
      "reason": "The repo composes the canonical Salt navigation primitives into one approved shell wrapper.",
      "docs": ["./docs/workspace-shell.md"]
    }
  ],
  "banned_choices": [
    {
      "name": "UNSTABLE_SaltProviderNext",
      "reason": "The repo is standardized on SaltProvider only.",
      "replacement": "SaltProvider",
      "docs": ["./docs/platform-conventions.md"]
    }
  ],
  "notes": [
    "Keep canonical Salt evidence and project convention declarations separate.",
    "Do not present project wrappers as if they were part of the official Salt registry."
  ]
}
